Clean,Diffusion
but they were not ,but they are not that
i'm going to the,i'm going to name
and you marcia,he marched
no one else behind this gate,no one else is behind this gate
the common,and with a 
how much time,how much he had
you ain't goin to get me to stay here,you ain't got to give me to stay
you go along and have a good time,you go along and have a good time
would into any good,wouldn't do any to
the good,footnote
why don't you say something,why did he say something
i never said i take it,i never said i take it
can depict,can a defect
now i was let you down,i london
what are you off,what are often
mecaenas full that month,no government
what war him,what do waterman
do you tell lies,do you tell why
i've been here for hours,i've been here for a
he like every boy,he like every boy
i could have joined this picture,i could have drawn this pitcher
a lot of these people are out of,a lot of these people are out of
commodus there,to moother
you will know me,you will know me
i said nothing,i said nothing
wait a minute,wait a minute
the road is blocked,then rollo
try to gain,try to gain
somebody called the police,somebody called a brief
why can't you be serious,why can't you be serious
armenia to say,what would not one to set
you go or have a good,you go on and have a good
i don't care what you charge them with,i don't care what you charge them 
ten minutes for what,ten minutes for what
the wind began to blow again,then began the loan
i didn't want the publicity,i didn't want no publicity
she had a cardigan,he had according
in it was the radio,penetration
would you like a capuchin,would you like a capon
i don't know why,i don't know why
i always have been,i always have the
come into my office,until
for ricofort,what had he got to report
you better get your friends,you better get your friends
i was impatient to see it opened,i was impatient to see it open
she improved list every day,in propriety
are you going to listen,are you going to listen
it was a suicide or sent,it was a suicide or sat
it's better to lay,it's better that way
some place to live,some place to live
that's why i'm here,that's why i'm here
in the alcando it,and no alicante
this is blot,that his beloved
they can't do that to me,they can't do that to me
if i got my hat,i put a non
where you will your him,where do you all your him
what do you mean you can't get away,what do you mean you can't get away
you hit my best friend,my best friend
but miss speak to,it was sir
sam's crazy about a,said creasy movement
given the work,given the works
and he told what he had seen,and he told what he had seen
now go at your dinner,now going within a
poole,little
he really was a king,he really was a king
what is the matter,what is the matter
they know it was an ancient,they know the one
in a little while,in a little while
i leave,sidenote
get throwed the works,it other
just you and i,just now and i
i never saw her before,i never therefore
a patagonian,a father
inherited,he related
the check will be certified,the check will be certified
even,the lensman
now look what you did,now look what you did
then he turned to the boy,then he turned to the boy
she was good enough for me,she was good enough for me
i'm not afraid of failing,and not all his sailing
the three fell side,the three fell side
what did i tell you,what did i tell you
let me out here,when mother
but they don't count,for they don't not
in savage,the fact
he is after money,he's after money
haven't you got any feeling,haven't you got any feeling
what is it counted,where is he coined
had it start,anita
i know where i can get a,now think better
i never saw before,i never saw one
then julia,the junior
and about you too,and outside
you have no children,you have no children
we carry the desk over,we'll carry the desk over
alas my will,i lost my all
you've got just ten minutes,you've got your pen
he was my brother,he was my bill
he believed to know men,he believes in omens
is it a good job,is that a good job
she lorinwood,the wooden
for crying out loud,crying out loud
what's the matter with my brain,what's the matter with the grey
it's not so bad,it's not so bad
what you like i stand,what you registered
again me a pen,gettin
the speech welcome to,his feet were in
with just a manner,the destination
how do you do,do you do
and now with a feeling,i know what you feel
on the divan town,when would you arrive in town
so you won't blame her,so you won't blame her
and now it,and you know
you have no children,you have no children
the bilitin,dobson
how do you feel,how do you feel
that's the best part of it,that's the best part of the
i'll be next door,i'll be next door
what's she saying now,what's she saying now
they mounted their horses,i mount their horses
you get to help us,he got the help us
let me call you her,let me come here
how much do you want,how much do you want
we wipe the boat,we like the book
that's what i was sent down for,that's what i was sent down for
reagan to blow,these began to blow
but he had to move on,but he had to moon
the counting that to me,he can't be that to me
then may today,when the fat
i want to live again,i want to live again
i'm going to them,and on to the
wenteline,we ointments
shall i pray for him,shall i pray to him
of fine doubter within,i'll find out owing
if i know where she is,if i know where she is
she didn't have one,she 
like this crowd up,break this crowd up
they can't help themselves,we can here
how much do you need,how much do you need
i do nothing of the sort,i do nothing of the sort
judge present me,such a rotten
licentious,why could this yours
but they don't come,but i am come
then she got out through the skylight,then she got out through the skylight
integrity and like it,digitalis
in the chalet,in the chariot
magnified down,manderton
the ladies in her,edison
no navigation,no emotion
i need the baneful,and the bacon
how much money do you get,how much money do you get
what's my function,what my function
how to fell a sittin here,and you too fell a setter
in the book,in the book
that says,that's a lie
let me see it,let me see
never mind those guys,never mind those times
or for you he said,i would be said
do you understand that,do you understand that
we've got to find him,we've got to finding
what good it do,what good it do
and alway to quit,and alway to quit
have her call me back,have i come back
i assure this country,i must poison
and if it is,and if it is
they continued across the desert,they continued across the desert
i am here a voice,i am he that my
what tricks would i pull,what price would i pour
listen to your heart,listen to your heart
help my friend mister richard,hold my friend mister richard
there are,there is a
we can't leave grace,the contractor
what have you in,what have your wings
help me voice,help me boys that
his name was joseph,his name was chosen
are we right here,i ll ride here
the coolies,i coombes
there's nothing wrong with the birds,there's nothing wrong with the books
the boy didn't know what,the boy didn't know 
they were his treasure,they were his treasure
minds in the door,minds in the door
they were say,an what ye say
have you seen my mom,have you seen my man
well then stand up,well then stand up
say something else,say something else
i forgot my hat,i took out my hands
i say we don't go out any more,i said you don't go out any more
can i get a look in,for they get a word
of course there is,a close there is
on now at it is,want to know what it is
allegory after it,i lighted
you had me worried,you had me worried
that close my account,the casement
i thought she was dead,but you will say
who else knows about this,the old knows about this
where do you come from,where do you come from
and that like to have it,and that one a habit
you've got the money,you've got the money
what more do you want,what more do you want
the capitol something,that the two something
i don't blame him,i don't play
he couldn't find his trees,i couldn't find high streets
i know later,i know that girl
he entered,he looks
must have been a kid,must have been a kid
that come to us,that come to us
the smell was noses,maria
and give me a pen,and give me a pin
then take an chances,on the benches
that's a lot of god,that's a lot of
you can get me,we often
it drew a drop of blood,it drew a droplight
a boy came running towards me,a voice raised
take good care of them,take good care of them
listen to the pope,list to the pope
only when he consents,only when people think
that's a lot of worry,but lot of truly
benito hurry,he never
they believe them,biberli him
i ought to inarticulate,mancocolam
i'm going to the,i'm going to the
her honor was seething,the assenting
his conge,his conge
having in a mossgrown,having in the misreckon
you have made children,you have been children
he's in the desk,he's in the death
i don't want missus douglas,i don't want missus douglas
i didn't do it,i think you do not love
i have a lunch at,i have a lunch at
he had never,he had several
don't say to see,but say
for you do him,and you do him
he was in tasteful,he was unfastened
i was impatient to see it ,increase
don't say those things,don't say those things
and will we do things,i will do things
he lives in your eye,you live in your eye
they enjoyed the silence,the joy in
how can you tell,how can you tell
everything's going to be all right,everything's going to be all right
so hemmenshaw,the homelier
something not around here,something smells are on her
don't you know me,certainly no man
take me back there,it mother
i think it is,i think it is
what did you have,what did you have
that's what i am,that i am
you keep out of this,if he bothers
as the man with my brain,as the man with my brain
diamonds are made at a pressure,diamonds are made at a pressure
got to get some practice,got to get some practice
the race it,you're a 
the idea frightened him,the idea frightened and
the baby can talk,the baby can talk
a breeze began to blow,the bristol
you you,you talk i am
i am concrete,i agree
you can't kid me,he can't kid me
morquil,a quickly
your heart is unlike,
i guess you're right,i guess you're right
but he didn't stop,but he didn't stop
of course i believe you,a possible 
it means my job,it means my job
and so do,and so drop
he was my brother,it was my brother
the money is not here,the money is not here
to know me,but no my
i'm sure you haven't any,i'm sure you haven't any
help me the boy said,of manhood
open all doors,on penelope
open all doors,gentile
open all doors,he was our
on all doors,no one else is behind this gate
on all,on his a
open all doors,he is done
open all day,you ain't got to give me to stay 
open all doors,you go along and have to tom
open all doors,well done
open all doors,i pitied
indoors,maraisfontein
open all doors,i never seen alice
open all doors,in a dog
open all doors,he was not gone
open all doors,what is the cost
open all doors,i cannot
open all doors,when a war
open all doors,i tell lies
open all doors,i've been here hours
open all doors,later
open all doors,like all of domestic
open all doors ,a lot of these people are out of 
all doors,the moros there
open all doors,you will note
open all doors,says nothing
open all doors,wait a minute
open all doors,the road
open all doors,twenty ten
open all doors,somebody called police
one all doors,why can't you be serious
open all doors,over all to say
open all doors,you go on the good
open all doors,i don't care what you charge on the
open all doors,mentally
open all doors,eagan the golden
open all doors,i been wont
open all doors,the coroner
open all doors,ministration
open all doors,would you like to casino
open all ,i don't know why
oh all doors,i always have the
open all doors,elsmere
open all doors,potatoes
open all doors,you benefits
open all doors,impatient he opened
computers,in proliferating
open all,are you going to listen
pears,it was a suicidal step
open doors,it's better that way
open all doors,some personal or
open all doors,that's why i'm here
open,and no one can do it
open all doors,the plot
open it do,they can't do that to me
open all doors,open
open,where you will your him
open all doors,what you mean you can't get away
open all doors,most
open all doors,but all to
in all new,so presume
open all doors,even the word
open all doors,if he told what he had seen
open all doors,no jeweller
open all doors,let
open all doors,he really was a king
open a door,what is the matter
open all doors,the elder
open all doors,in anywise
open all doors,ominous
open all doors,he called
open all doors,just you and i
open all doors,in that arcadian
open all doors,evander
open all doors,the curate
open all doors,the frequenters
open all doors,elsie
in all doors,now look what you did
open all doors,prothero
open all doors,chocolate
open doors,not afraid of family
open all for,the three fell soil
open all doors,i obey
open all doors,really
open all doors,if they want to
open all doors,on a a
open all doors,this after
open gates,haven't i got any feeling
open all doors,when i count
open all doors,i venator
on all ,now we can get a
all doors,i never saw one
open a door,the like
open all doors,and even
open all doors,you have no control
open all doors,he carried the escort
open all doors,alone
open all doors,you all
open all doors,my dear
open all doors,he believed in it on
open all doors,it veneda
open all doors,he lived
open all doors,in only
open all doors,what's the matter upon
operators,it's not so bad
open all doors,what you like i do
peneleos,gentle
sewell,his feet robinson
open all doors,we attain
all doors,do you do
open all doors,and other
women all doors,one dorien
open all doors,so you want to over
open all doors,pensive
open all doors,he has no children
open all doors,decatur
operators,how do you feel
open all doors,pepeeta
open a door,i'll be next door
operators,what's she saying now
senators,they mounted their horses
renaldo,you got to help us
open all doors,then he came to
open all doors,how much do you want
open all doors,he was too
all down,that's what i was sent down for
open all doors,he began to blow
operator,but he had to move a
open all doors,you can't atone
open all doors,matheson
penalties,i want to live again
open all doors,and as to
open all doors,anyone
open all doors,shall i pay for her
penalties,a fine doubt or wetting
open always,if i know where she is
open all doors,she isn't as a
on all too,like this crowd up
open all doors,it will hold water
open all doors,how much does
open all doors,alors
pelle,tears
open all doors,i headers
open all doors,but i don't come
open all doors,then she got out to this or
open all doors,dictionaries
open all,in the hall and told
open all doors,moderation
open all doors,mediator
amaldi,no the getysberg
all doors,i need the baneful
open all doors,how much money been
one does,once my sanction
open all doors,he fell senator
open all doors,pinedo
the allies,but say
open all doors,let nothing 
open all doors,never make doors
open all doors,i will do 
open altar,do you understand that
open all doors,we got to find
opened,what good it do
open all doors,and always
open all doors,cover caldigate
open all doors,isolation
open all doors,and eliduc
open all doors,continue to cross the don
open all doors,in almost
open all doors,or pick would i fear
open all doors,westenra
peter,on my friend mister richard
open all doors,then all desire
only doors,the candle rather
operators,what have your wings
open all doors,hoping to do
open all ,his man was too
open all doors,i wearied her
open all doors,coombes
open all doors,there's nothing wrong with the works
open all doors ,according to
open all doors,fame had treasure
open all doors,more in the door
open all doors,and what say
open all doors,have you seen what a long
open well done,well then stand up
open all doors,and something else
open all doors,i took out my hands
open all doors,i say old out
open all doors,father got a door
open all doors,he called de
penalties,on one antis
open all doors,later
open all doors,you will have or
open all doors,tell calico
open all doors,the shelter
open all doors,the electors
open all doors,where i too prone
and all too,and that it ended
open all doors,i got to run
open all doors,what more do you want
open all doors,he hated something
even leaders,i don't play me
open all doors,in fiori
open all doors,and alice
open all doors,poor
open all doors,mosaide
open all doors,that all comes
then all doors,none
open all doors,and i mean
open all doors,then we can rejoice
open all doors,and although
open all doors,people do
operators,andrew a droplight
all doors,a boy to romantic
operators,taggart
open all doors,this order
operators,online
penelope,at latour
open all doors,begged
open all doors,the belief
open all doors,ogalalas
open all doors,i pointed
open all doors,allow
open a dog,his going to get in
open all ,i restate
open all dose,the pencil
open all doors,estenega
on actors,i don't want missus douglas
open all do,i didn't do a little
open all doors,have a long day
open all doors,i peel
open all doors,open
open all doors,one you doin
operators,he was a pastel
open all doors,only patronised
open all doors,don't say those things
open all doors,and it will be dusk
open all doors,he lovingly
open all doors,enjoy the finest
open doors,how can you tell
on all too,everything's going to be all right
open all doors,i hope major
open all doors,something smooth
open all doors,i know 
open all doors,candace
open all doors,i think it is
open all doors,well as you have
open all doors,penton
open all doors,you can atone
open all ,as the lawyer
open all doors,and aeneas
all doors,got to get some crackers
open all doors,marie
open all doors,the ideal writing
open all doors,a baby can talk
again a door,separation
open all doors,you talk i can
open all doors,i enclose
pantaloons,you can't kid me
open all doors,cool
open all doors,i 
open all doors,i can follow
open all doors,he did do
open all doors,possibly you
open all doors,i mean my god
open all doors,pen solar
open all doors,he was like others
open all doors,the man is noble
open all doors,don't go
open all doors,she had an
openly or,oppose
